{
  "$schema": "https://OpenUniLex.org/schemas/language_specific/zol/v1.0.0.zol_features.schema.json",
  "lemma": "manlangtakin",
  "upos": "ADV",
  "dialect_tag": "UNIVERSAL",
  "semantic_domain": "3.5.2.1",
  "morph_type": "DERIVATIONAL",
  "xpos": "ADV",
  "feats": {
    "universal": {},
    "language_specific": {
      "zol": {}
    }
  },
  "senses": [
    {
      "sense_id": "manlangtakin_ADV_01_SENSE_01_MANNER",
      "gloss": "quickly",
      "semantic_domain": "3.5.2.1",
      "valency_frame": {
        "valency_type": "clausal_modifier",
        "arguments": [
          {
            "role": "MANNER_MODIFIER",
            "deprel": "advmod",
            "description": "Modifies a dynamic action predicate to define the rapid manner or speed of the event.",
            "is_obligatory": false
          }
        ]
      },
      "contextual_requirements": {
        "following_element": {
          "upos": "VERB",
          "note": "Precedes the head verb phrase it modifies, frequently co-occurring with directional or aspectual markers."
        }
      },
      "examples": [
        {
          "surface_text": "Manlangtakin hong pai in.",
          "english_translation": "Come quickly.",
          "gloss_alignment": [
            {
              "token": "Manlangtakin",
              "morphemes": [
                "manlang",
                "-takin"
              ],
              "gloss": "quickly",
              "upos_target": "ADV"
            },
            {
              "token": "hong",
              "morphemes": [
                "hong"
              ],
              "gloss": "1/2.OBJ_DIR",
              "upos_target": "PRON"
            },
            {
              "token": "pai",
              "morphemes": [
                "pai"
              ],
              "gloss": "come.StemI",
              "upos_target": "VERB"
            },
            {
              "token": "in",
              "morphemes": [
                "in"
              ],
              "gloss": "IMP",
              "upos_target": "PART"
            }
          ],
          "external_links": {
            "ili_id": "",
            "verbnet_class": ""
          }
        }
      ]
    }
  ],
  "pos_payload": {
    "token_class": "adverb",
    "modifier_type": "MANNER",
    "modification_scope": "VERBAL",
    "attachment_target": "PREVERBAL",
    "functional_scope": "ASPECTUAL",
    "ud_deprel_default": "advmod",
    "surface_forms": [
      "manlangtakin"
    ],
    "structural_constraints": [
      "Formed via derivation by affixing the adverbializing suffix '-takin' onto the root predicate base 'manlang'.",
      "In a UD syntax tree, it attaches directly to the primary verbal head node ('pai') via an 'advmod' dependency relation.",
      "Attaches directly to the left of the verbal head phrase projection."
    ],
    "internal_structure": {
      "root_lemma": "manlang",
      "reduplication_type": "NONE",
      "morphotactics": "ROOT + -takin"
    }
  },
  "metadata": {
    "source": "Zomi NLP Core Treebank Projects",
    "authors": [
      "zomi-nlp-engine-team"
    ],
    "license": "MIT",
    "created_by": "automated_parser_v0.4.0",
    "created_at": "2026-07-08T02:40:00Z",
    "status": "VALIDATED",
    "ud_compliant": true,
    "version": 1
  }
}