{
  "$schema": "https://OpenUniLex.org/schemas/language_specific/zol/v1.0.0.zol_features.schema.json",
  "lemma": "amahnu",
  "upos": "PRON",
  "dialect_tag": "STANDARD",
  "gloss": "she",
  "semantic_domain": "1.1.1_PRONOUN",
  "xpos": "PRON",
  "morph_type": "INFLECTIONAL",
  "feats": {
    "universal": {
      "Person": "3",
      "Number": "Sing",
      "PronType": "Prs",
      "Gender": "Fem"
    },
    "language_specific": {
      "zol": {}
    }
  },
  "senses": [
    {
      "sense_id": "amahnu_PRON_01_SENSE_01_SUBJ",
      "gloss": "she (subjective)",
      "semantic_domain": "1.1.1_PRONOUN",
      "valency_frame": {
        "valency_type": "nominal_argument",
        "arguments": [
          {
            "role": "ARGUMENT",
            "deprel": "nsubj",
            "description": "Licenses distribution as a core nominal subject.",
            "is_obligatory": true
          }
        ]
      },
      "contextual_requirements": null,
      "examples": [
        {
          "surface_text": "Amahnu pai hi.",
          "english_translation": "She goes.",
          "gloss_alignment": [
            { "token": "Amahnu", "gloss": "she", "upos_target": "PRON" },
            { "token": "pai", "gloss": "go", "upos_target": "VERB" },
            { "token": "hi", "gloss": "ASSERT", "upos_target": "PART" }
          ]
        }
      ]
    },
    {
      "sense_id": "amahnu_PRON_01_SENSE_01_OBJ",
      "gloss": "her (objective)",
      "semantic_domain": "1.1.1_PRONOUN",
      "valency_frame": {
        "valency_type": "nominal_argument",
        "arguments": [
          {
            "role": "ARGUMENT",
            "deprel": "obj",
            "description": "Licenses distribution as a core nominal direct object.",
            "is_obligatory": true
          }
        ]
      },
      "contextual_requirements": null,
      "examples": [
        {
          "surface_text": "Amahnu mu ing.",
          "english_translation": "I see her.",
          "gloss_alignment": [
            { "token": "Amahnu", "gloss": "her", "upos_target": "PRON" },
            { "token": "mu", "gloss": "see", "upos_target": "VERB" },
            { "token": "ing", "gloss": "1SG", "upos_target": "PRON" }
          ]
        }
      ]
    }
  ],
  "pos_payload": {
    "token_class": "pronoun",
    "functional_scope": "PERSONAL",
    "gender": "feminine",
    "case": "default",
    "ud_deprel_default": "nsubj",
    "surface_forms": [
      "amahnu"
    ],
    "usage_notes": "Third-person singular feminine pronoun meaning 'she'."
  },
  "metadata": {
    "source": "zol lexicon",
    "authors": [
      "OpenUniLex"
    ],
    "license": "CC-BY-SA-4.0",
    "created_by": "OpenUniLex",
    "created_at": "2026-07-07T19:35:00Z",
    "status": "VALIDATED",
    "version": 1
  }
}