{
  "$schema": "https://OpenUniLex.org/schemas/language_specific/zol/v1.0.0.zol_features.schema.json",
  "lemma": "itna",
  "upos": "NOUN",
  "dialect_tag": "UNIVERSAL",
  "gloss": "love",
  "semantic_domain": "2.1.2_RECOGNITION_OF_VALUE",
  "morph_type": "DERIVATIONAL",
  "feats": {
    "universal": {
      "Number": "Sing",
      "Animacy": "Inan",
      "Case": "Abs"
    },
    "language_specific": {
      "zol": {
        "NounClass": "Class3"
      }
    }
  },
  "senses": [
    {
      "sense_id": "itna_NOUN_01_SENSE_01",
      "gloss": "love",
      "semantic_domain": "2.1.2_RECOGNITION_OF_VALUE",
      "valency_frame": {
        "valency_type": "stative",
        "arguments": [
          {
            "role": "EXPERIENCER",
            "deprel": "nmod",
            "is_obligatory": false
          },
          {
            "role": "THEME",
            "deprel": "nmod",
            "is_obligatory": false
          }
        ]
      },
      "contextual_requirements": null,
      "examples": [
        {
          "surface_text": "Itna thupi hi.",
          "english_translation": "Love is great.",
          "gloss_alignment": [
            {
              "token": "Itna",
              "gloss": "love",
              "upos_target": "NOUN"
            },
            {
              "token": "thupi",
              "gloss": "great",
              "upos_target": "ADJ"
            },
            {
              "token": "hi",
              "gloss": "ASSERT",
              "upos_target": "PART"
            }
          ]
        }
      ]
    }
  ],
  "pos_payload": {
    "token_class": "common_noun",
    "noun_class": "ABSTRACT",
    "countability": "MASS",
    "surface_forms": [
      "itna"
    ],
    "internal_structure": {
      "derivation_details": {
        "base_lemma": "it",
        "base_upos": "VERB",
        "process": "NOMINALIZATION",
        "morpheme": "-na"
      },
      "is_compound": false,
      "morphotactics": "STEM_I + -na"
    }
  },
  "metadata": {
    "source": "zol lexicon",
    "authors": [
      "OpenUniLex"
    ],
    "license": "CC-BY-SA-4.0",
    "created_by": "linguist_team",
    "created_at": "2026-07-07T10:17:00Z",
    "status": "VALIDATED",
    "ud_compliant": true,
    "version": 1
  }
}