{
  "$schema": "https://OpenUniLex.org/schemas/language_specific/zol/v1.0.0.zol_features.schema.json",
  "lemma": "pai",
  "upos": "VERB",
  "dialect_tag": "UNIVERSAL",
  "gloss": "go",
  "semantic_domain": "7.2.1.1",
  "morph_type": "INFLECTIONAL",
  "feats": {
    "universal": {
      "Aspect": "Imp",
      "Mood": "Ind",
      "Voice": "Act",
      "VerbForm": "Fin"
    },
    "language_specific": {
      "zol": {
        "Directional": "Toward",
        "Evidential": "Direct",
        "SerialVerb": "Sequential"
      }
    }
  },
  "senses": [
    {
      "sense_id": "pai_VERB_01_SENSE_01",
      "gloss": "go",
      "semantic_domain": "7.2.1.1",
      "valency_frame": {
        "valency_type": "intransitive",
        "arguments": [
          {
            "role": "AGENT",
            "deprel": "nsubj",
            "is_obligatory": true
          },
          {
            "role": "LOCATION_DESTINATION",
            "deprel": "obl",
            "is_obligatory": false
          }
        ]
      },
      "contextual_requirements": null,
      "examples": [
        {
          "surface_text": "Kalaymyo ah ka pai hi.",
          "english_translation": "I go to Kalaymyo.",
          "gloss_alignment": [
            {
              "token": "Kalaymyo",
              "morphemes": [
                "Kalaymyo"
              ],
              "gloss": "Kalaymyo",
              "upos_target": "PROPN"
            },
            {
              "token": "ah",
              "morphemes": [
                "ah"
              ],
              "gloss": "LOC",
              "upos_target": "ADP"
            },
            {
              "token": "ka",
              "morphemes": [
                "ka"
              ],
              "gloss": "1SG.SUBJ",
              "upos_target": "PRON"
            },
            {
              "token": "pai",
              "morphemes": [
                "pai"
              ],
              "gloss": "go.StemI",
              "upos_target": "VERB"
            },
            {
              "token": "hi",
              "morphemes": [
                "hi"
              ],
              "gloss": "DECL",
              "upos_target": "PART"
            }
          ],
          "external_links": {
            "ili_id": "i26941",
            "verbnet_class": "escape-51.1"
          }
        }
      ]
    },
    {
      "sense_id": "pai_VERB_01_SENSE_02",
      "gloss": "come",
      "semantic_domain": "7.2.3.1",
      "valency_frame": {
        "valency_type": "intransitive",
        "arguments": [
          {
            "role": "AGENT",
            "deprel": "nsubj",
            "is_obligatory": true
          },
          {
            "role": "SOURCE_LOCATION",
            "deprel": "obl",
            "is_obligatory": false
          },
          {
            "role": "DESTINATION_LOCATION",
            "deprel": "obl",
            "is_obligatory": false
          }
        ]
      },
      "contextual_requirements": {
        "required_modifiers": [
          "hong",
          "kong",
          "ong",
          "nong"
        ],
        "description": "Triggered exclusively via composition with deictic direction particles pointing toward the speaker or listener."
      },
      "examples": [
        {
          "surface_text": "Inndei pen ah hong pai in!",
          "english_translation": "Come to the room!",
          "gloss_alignment": [
            {
              "token": "Inndei",
              "morphemes": [
                "inn",
                "dei"
              ],
              "gloss": "room",
              "upos_target": "NOUN"
            },
            {
              "token": "pen",
              "morphemes": [
                "pen"
              ],
              "gloss": "DEF",
              "upos_target": "DET"
            },
            {
              "token": "ah",
              "morphemes": [
                "ah"
              ],
              "gloss": "LOC",
              "upos_target": "ADP"
            },
            {
              "token": "hong",
              "morphemes": [
                "hong"
              ],
              "gloss": "DIR.TO_SPEAKER",
              "upos_target": "PART"
            },
            {
              "token": "pai",
              "morphemes": [
                "pai"
              ],
              "gloss": "go.StemI",
              "upos_target": "VERB"
            },
            {
              "token": "in",
              "morphemes": [
                "in"
              ],
              "gloss": "IMP",
              "upos_target": "PART"
            }
          ],
          "external_links": {
            "ili_id": "i26941",
            "verbnet_class": "come-51.3.2"
          }
        }
      ]
    }
  ],
  "pos_payload": {
    "stem_alternations": {
      "stem_i": "pai"
    }
  },
  "metadata": {
    "source": "Zomi NLP Core Treebank Projects",
    "authors": [
      "zomi-nlp-engine-team",
      "OpenUniLex"
    ],
    "license": "CC-BY-SA-4.0",
    "created_by": "linguist_team",
    "created_at": "2026-07-06T22:05:00Z",
    "status": "VALIDATED",
    "ud_compliant": true,
    "version": 1,
    "change_log": [
      {
        "edited_by": "linguistic_validator",
        "edited_at": "2026-07-07T06:34:00Z",
        "fields_modified": [
          "pos_payload.examples"
        ],
        "purpose": "Add example corresponding to the sense of pai (directionality toward speaker or as a response to the speaker)."
      }
    ]
  }
}