{
  "$schema": "https://OpenUniLex.org/schemas/language_specific/zol/v1.0.0.zol_features.schema.json",
  "lemma": "it",
  "upos": "VERB",
  "dialect_tag": "UNIVERSAL",
  "gloss": "love",
  "semantic_domain": "2.1.2_RECOGNITION_OF_VALUE",
  "morph_type": "INFLECTIONAL",
  "feats": {
    "universal": {
      "Aspect": "Imp",
      "Mood": "Ind",
      "Voice": "Act",
      "VerbForm": "Fin",
      "Polarity": "Pos"
    },
    "language_specific": {
      "zol": {
        "Evidential": "Direct"
      }
    }
  },
  "senses": [
    {
      "sense_id": "it_VERB_01_SENSE_01_LOVE",
      "gloss": "love",
      "semantic_domain": "2.1.2",
      "valency_frame": {
        "valency_type": "transitive",
        "arguments": [
          {
            "role": "AGENT",
            "deprel": "nsubj",
            "description": "The entity experiencing the deep affection, valuation, or love.",
            "is_obligatory": true
          },
          {
            "role": "PATIENT",
            "deprel": "obj",
            "description": "The entity toward whom the affection or value is directed.",
            "is_obligatory": true
          }
        ]
      },
      "contextual_requirements": {
        "preceding_element": {
          "upos": "PRON",
          "note": "Often preceded by high-transitivity agreement/agreement-direction markers or person clitics like 'kong' within finite clausal frames."
        }
      },
      "examples": [
        {
          "surface_text": "Kong it hi.",
          "english_translation": "I love you.",
          "gloss_alignment": [
            {
              "token": "Kong",
              "morphemes": ["kong"],
              "gloss": "1SG>2SG",
              "upos_target": "PRON"
            },
            {
              "token": "it",
              "morphemes": ["it"],
              "gloss": "love",
              "upos_target": "VERB"
            },
            {
              "token": "hi",
              "morphemes": ["hi"],
              "gloss": "ASSERT",
              "upos_target": "PART"
            }
          ],
          "external_links": {
            "ili_id": "i30973",
            "verbnet_class": "love-31.1"
          }
        }
      ]
    }
  ],
  "pos_payload": {
    "token_class": "main_verb",
    "surface_forms": [
      "it"
    ],
    "stem_alternations": {
      "stem_i": "it",
      "stem_ii": "it"
    }
  },
  "metadata": {
    "source": "zol lexicon",
    "authors": [
      "OpenUniLex"
    ],
    "license": "CC-BY-SA-4.0",
    "created_by": "linguist_team",
    "created_at": "2026-06-12",
    "status": "VALIDATED",
    "ud_compliant": true,
    "version": 1
  }
}