{
    "$schema": "https://OpenUniLex.org/schemas/language_specific/zol/v1.0.0.zol_features.schema.json",
    "lemma": "in",
    "upos": "ADP",
    "dialect_tag": "UNIVERSAL",
    "semantic_domain": "3.5.1.2",
    "morph_type": "NONE",
    "xpos": "ADP",
    "feats": {
        "universal": {
            "Case": "Erg"
        },
        "language_specific": {
            "zol": {}
        }
    },
    "senses": [
        {
            "sense_id": "in_ADP_01_SENSE_01_ERG",
            "gloss": "ergative case marker",
            "semantic_domain": "3.5.1.2",
            "valency_frame": {
                "valency_type": "case_marking",
                "arguments": [
                    {
                        "role": "MARKER",
                        "deprel": "case",
                        "description": "Attaches postpositionally to a noun phrase to mark the agent of a transitive verb.",
                        "is_obligatory": true
                    }
                ]
            },
            "contextual_requirements": {
                "preceding_element": {
                    "upos": "PRON",
                    "note": "Can also accept NOUN or PROPN as a nominal host."
                },
                "clausal_context": {
                    "verb_valency": "transitive",
                    "note": "Requires the presence of an object or an inherently transitive verbal construction."
                }
            },
            "examples": [
                {
                    "surface_text": "Amah in an ne hi.",
                    "english_translation": "He/She ate food.",
                    "gloss_alignment": [
                        {
                            "token": "Amah",
                            "morphemes": [
                                "amah"
                            ],
                            "gloss": "he/she",
                            "upos_target": "PRON"
                        },
                        {
                            "token": "in",
                            "morphemes": [
                                "in"
                            ],
                            "gloss": "ERG",
                            "upos_target": "ADP"
                        },
                        {
                            "token": "an",
                            "morphemes": [
                                "an"
                            ],
                            "gloss": "food",
                            "upos_target": "NOUN"
                        },
                        {
                            "token": "ne",
                            "morphemes": [
                                "ne"
                            ],
                            "gloss": "eat.StemI",
                            "upos_target": "VERB"
                        },
                        {
                            "token": "hi",
                            "morphemes": [
                                "hi"
                            ],
                            "gloss": "ASSERT",
                            "upos_target": "PART"
                        }
                    ],
                    "external_links": {
                        "ili_id": "",
                        "verbnet_class": ""
                    }
                }
            ]
        },
        {
            "sense_id": "in_ADP_01_SENSE_02_INS",
            "gloss": "instrumental case marker",
            "semantic_domain": "3.5.1.2",
            "valency_frame": {
                "valency_type": "case_marking",
                "arguments": [
                    {
                        "role": "MARKER",
                        "deprel": "case",
                        "description": "Attaches postpositionally to an inanimate noun phrase to mark the instrument used to perform an action.",
                        "is_obligatory": true
                    }
                ]
            },
            "contextual_requirements": {
                "preceding_element": {
                    "upos": "NOUN",
                    "note": "Typically selects for an inanimate noun phrase acting as a tool or means."
                }
            },
            "examples": [
                {
                    "surface_text": "Temta in at in.",
                    "english_translation": "Cut it with a knife.",
                    "gloss_alignment": [
                        {
                            "token": "Temta",
                            "morphemes": [
                                "tem",
                                "ta"
                            ],
                            "gloss": "knife",
                            "upos_target": "NOUN"
                        },
                        {
                            "token": "in",
                            "morphemes": [
                                "in"
                            ],
                            "gloss": "INS",
                            "upos_target": "ADP"
                        },
                        {
                            "token": "at",
                            "morphemes": [
                                "at"
                            ],
                            "gloss": "cut.StemI",
                            "upos_target": "VERB"
                        },
                        {
                            "token": "in",
                            "morphemes": [
                                "in"
                            ],
                            "gloss": "IMP",
                            "upos_target": "PART"
                        }
                    ],
                    "external_links": {
                        "ili_id": "",
                        "verbnet_class": ""
                    }
                }
            ]
        }
    ],
    "pos_payload": {
        "token_class": "adposition",
        "binding_type": "CASE_MARKING",
        "attachment_target": "POSTPOSITIONAL",
        "ud_deprel_default": "case",
        "surface_forms": [
            "in"
        ],
        "structural_constraints": [
            "Attaches postpositionally to nominal hosts (PRON, NOUN, PROPN).",
            "Cannot contract with plural markers or compound nominal expressions un-cliticized."
        ]
    },
    "metadata": {
        "source": "Zomi NLP Core Treebank Projects",
        "authors": [
            "zomi-nlp-engine-team"
        ],
        "license": "MIT",
        "created_by": "automated_parser_v0.4.0",
        "created_at": "2026-07-07T20:05:00Z",
        "status": "VALIDATED",
        "ud_compliant": true,
        "version": 1
    }
}