{
  "$schema": "https://OpenUniLex.org/schemas/language_specific/zol/v1.0.0.zol_features.schema.json",
  "lemma": "pai",
  "upos": "VERB",
  "dialect_tag": "UNIVERSAL",
  "gloss": "throw",
  "semantic_domain": "1.4.1.2_THROW",
  "morph_type": "INFLECTIONAL",
  "feats": {
    "universal": {
      "Aspect": "Imp",
      "Mood": "Imp",
      "Voice": "Act",
      "VerbForm": "Fin",
      "Polarity": "Neg"
    },
    "language_specific": {
      "zol": {
        "Evidential": "Direct"
      }
    }
  },
  "senses": [
    {
      "sense_id": "pai_VERB_02_SENSE_01_THROW",
      "gloss": "throw",
      "semantic_domain": "1.4.1.2",
      "valency_frame": {
        "valency_type": "transitive",
        "arguments": [
          {
            "role": "AGENT",
            "deprel": "nsubj",
            "description": "The entity initiating the physical act of throwing or discarding.",
            "is_obligatory": false
          },
          {
            "role": "PATIENT",
            "deprel": "obj",
            "description": "The physical object or substance that is thrown, cast, or discarded.",
            "is_obligatory": true
          }
        ]
      },
      "contextual_requirements": {
        "following_element": {
          "upos": "PART",
          "note": "Followed by negative imperative auxiliary or particle configurations like 'kei' + 'in' in prohibitive expressions."
        }
      },
      "examples": [
        {
          "surface_text": "An pai kei in!",
          "english_translation": "Do not throw food!",
          "gloss_alignment": [
            {
              "token": "An",
              "morphemes": ["an"],
              "gloss": "food",
              "upos_target": "NOUN"
            },
            {
              "token": "pai",
              "morphemes": ["pai"],
              "gloss": "throw.StemI",
              "upos_target": "VERB"
            },
            {
              "token": "kei",
              "morphemes": ["kei"],
              "gloss": "NEG",
              "upos_target": "PART"
            },
            {
              "token": "in",
              "morphemes": ["in"],
              "gloss": "IMP",
              "upos_target": "PART"
            }
          ],
          "external_links": {
            "ili_id": "i27614",
            "verbnet_class": "throw-17.1"
          }
        }
      ]
    }
  ],
  "pos_payload": {
	"token_class": "main_verb",
    "stem_alternations": {
      "stem_i": "pai",
      "stem_ii": "paih"
    },
	"surface_forms": [
	  "pai"
	]
  },
  "metadata": {
    "source": "zol lexicon",
    "authors": [
      "OpenUniLex"
    ],
    "license": "CC-BY-SA-4.0",
    "created_by": "linguist_team",
    "created_at": "2026-07-08T04:54:00Z",
    "status": "VALIDATED",
    "ud_compliant": true,
    "version": 1
  }
}